{
  "$schema": "http://json-schema.org/draft-07/schema#",
  "title": "DNSProvider",
  "type": "object",
  "required": ["id", "name", "website", "country", "profiles"],
  "additionalProperties": false,
  "properties": {
    "id": {
      "type": "string",
      "pattern": "^[a-z0-9-]+$"
    },
    "name": {
      "type": "string",
      "minLength": 2
    },
    "website": {
      "type": "string",
      "format": "uri"
    },
    "country": {
      "type": "string",
      "description": "ISO 3166-1 alpha-2 code, or GLOBAL/EU",
      "pattern": "^(GLOBAL|EU|[A-Z]{2})$"
    },
    "profiles": {
      "type": "array",
      "minItems": 1,
      "items": {
        "type": "object",
        "required": ["id", "name", "primaryCategory", "tags", "endpoints"],
        "additionalProperties": false,
        "properties": {
          "id": {
            "type": "string",
            "pattern": "^[a-z0-9-]+$"
          },
          "name": {
            "type": "string",
            "minLength": 2
          },
          "primaryCategory": {
            "type": "string",
            "enum": [
              "General",
              "Ad-Blocking",
              "Security",
              "Family",
              "Regional",
              "Gaming"
            ]
          },
          "tags": {
            "type": "array",
            "uniqueItems": true,
            "items": {
              "type": "string",
              "enum": [
                "doh",
                "dot",
                "ipv4",
                "ipv6",
                "adblock",
                "no-log",
                "bypass",
                "malware-blocking"
              ]
            }
          },
          "endpoints": {
            "type": "object",
            "additionalProperties": false,
            "properties": {
              "primaryDns": { "type": ["string", "null"], "format": "ipv4" },
              "secondaryDns": { "type": ["string", "null"], "format": "ipv4" },
              "ipv6Primary": { "type": ["string", "null"], "format": "ipv6" },
              "ipv6Secondary": { "type": ["string", "null"], "format": "ipv6" },
              "dohUrl": { "type": ["string", "null"], "format": "uri" },
              "dotHostname": { "type": ["string", "null"] }
            }
          },
          "notes": {
            "type": "string"
          }
        }
      }
    }
  }
}
