{
  "id": "applied-privacy",
  "name": "Foundation for Applied Privacy",
  "website": "https://applied-privacy.net",
  "country": "AT",
  "profiles": [
    {
      "id": "default",
      "name": "Privacy Resolver",
      "primaryCategory": "General",
      "tags": ["doh", "dot", "no-log"],
      "endpoints": {
        "primaryDns": null,
        "secondaryDns": null,
        "ipv6Primary": null,
        "ipv6Secondary": null,
        "dohUrl": "https://doh.applied-privacy.net/query",
        "dotHostname": "dot1.applied-privacy.net"
      },
      "notes": "Austrian non-profit promoting digital privacy and uncensored encrypted DNS. Plain port 53 is disabled."
    }
  ]
}
