{
  "id": "safedns",
  "name": "SafeDNS",
  "website": "https://www.safedns.com",
  "country": "GLOBAL",
  "profiles": [
    {
      "id": "default",
      "name": "Threat Protection",
      "primaryCategory": "Security",
      "tags": ["ipv4", "ipv6", "malware-blocking"],
      "endpoints": {
        "primaryDns": "195.46.39.39",
        "secondaryDns": "195.46.39.40",
        "ipv6Primary": "2001:67c:2778::3939",
        "ipv6Secondary": "2001:67c:2778::3940",
        "dohUrl": null,
        "dotHostname": null
      },
      "notes": "Global Anycast resolvers with AI-driven categorization for blocking malicious, phishing, and scam domains."
    }
  ]
}
