{
  "id": "fdn",
  "name": "French Data Network (FDN)",
  "website": "https://www.fdn.fr/actions/dns/",
  "country": "FR",
  "profiles": [
    {
      "id": "default",
      "name": "Uncensored Resolver",
      "primaryCategory": "General",
      "tags": ["ipv4", "ipv6", "no-log"],
      "endpoints": {
        "primaryDns": "80.67.169.12",
        "secondaryDns": "80.67.169.40",
        "ipv6Primary": "2001:910:800::12",
        "ipv6Secondary": "2001:910:800::40",
        "dohUrl": null,
        "dotHostname": null
      },
      "notes": "France's oldest non-profit ISP. Non-censoring, strictly unfiltered, and logs nothing."
    }
  ]
}
