{
  "id": "chunghwa-telecom",
  "name": "Chunghwa Telecom (HiNet)",
  "website": "https://www.cht.com.tw",
  "country": "TW",
  "profiles": [
    {
      "id": "default",
      "name": "Public Recursor",
      "primaryCategory": "Regional",
      "tags": ["ipv4", "ipv6"],
      "endpoints": {
        "primaryDns": "168.95.1.1",
        "secondaryDns": "168.95.192.1",
        "ipv6Primary": "2001:b000:168::1",
        "ipv6Secondary": "2001:b000:168::2",
        "dohUrl": null,
        "dotHostname": null
      },
      "notes": "Dominant Taiwanese ISP recursive resolver infrastructure (dns.hinet.net) accessible across East Asia."
    }
  ]
}
