{
  "id": "sk-broadband",
  "name": "SK Broadband",
  "website": "https://www.skbroadband.com",
  "country": "KR",
  "profiles": [
    {
      "id": "default",
      "name": "Public Recursor",
      "primaryCategory": "Regional",
      "tags": ["ipv4"],
      "endpoints": {
        "primaryDns": "219.250.36.130",
        "secondaryDns": "210.220.163.82",
        "ipv6Primary": null,
        "ipv6Secondary": null,
        "dohUrl": null,
        "dotHostname": null
      },
      "notes": "SK Telecom / SK Broadband backbone recursive DNS endpoints. Enforces domestic KCSC regulatory website filtering."
    }
  ]
}
