{
  "id": "njalla",
  "name": "Njalla",
  "website": "https://dns.njal.la",
  "country": "GLOBAL",
  "profiles": [
    {
      "id": "default",
      "name": "Public Encrypted Recursor",
      "primaryCategory": "General",
      "tags": ["doh", "dot", "ipv4", "ipv6", "no-log"],
      "endpoints": {
        "primaryDns": "95.215.19.53",
        "secondaryDns": null,
        "ipv6Primary": "2001:67c:2354:2::53",
        "ipv6Secondary": null,
        "dohUrl": "https://dns.njal.la/dns-query",
        "dotHostname": "dns.njal.la"
      },
      "notes": "Privacy-focused, non-logging open resolver operating across standard, DoT, and DoH protocols."
    }
  ]
}
