{
  "id": "starhub",
  "name": "StarHub",
  "website": "https://www.starhub.com",
  "country": "SG",
  "profiles": [
    {
      "id": "default",
      "name": "Public Recursor",
      "primaryCategory": "Regional",
      "tags": ["ipv4"],
      "endpoints": {
        "primaryDns": "203.116.1.78",
        "secondaryDns": "203.116.1.94",
        "ipv6Primary": null,
        "ipv6Secondary": null,
        "dohUrl": null,
        "dotHostname": null
      },
      "notes": "StarHub core public recursive resolving infrastructure in Singapore. Enforces IMDA regulatory domain blocks."
    }
  ]
}
