{
  "id": "dismail",
  "name": "Dismail.de",
  "website": "https://dismail.de",
  "country": "DE",
  "profiles": [
    {
      "id": "fdns1",
      "name": "Server 1 (Ad & Tracker Blocking)",
      "primaryCategory": "Ad-Blocking",
      "tags": ["doh", "dot", "adblock", "no-log", "malware-blocking"],
      "endpoints": {
        "primaryDns": null,
        "secondaryDns": null,
        "ipv6Primary": null,
        "ipv6Secondary": null,
        "dohUrl": "https://fdns1.dismail.de/dns-query",
        "dotHostname": "fdns1.dismail.de"
      },
      "notes": "German privacy activist encrypted DNS with automated ad-blocking, tracking protection, and zero logging. Port 53 is disabled."
    },
    {
      "id": "fdns2",
      "name": "Server 2 (Ad & Tracker Blocking)",
      "primaryCategory": "Ad-Blocking",
      "tags": ["doh", "dot", "adblock", "no-log", "malware-blocking"],
      "endpoints": {
        "primaryDns": null,
        "secondaryDns": null,
        "ipv6Primary": null,
        "ipv6Secondary": null,
        "dohUrl": "https://fdns2.dismail.de/dns-query",
        "dotHostname": "fdns2.dismail.de"
      },
      "notes": "Secondary node for Dismail.de encrypted resolver network. Port 53 is disabled."
    }
  ]
}
