{
  "id": "deutsche-telekom",
  "name": "Deutsche Telekom",
  "website": "https://www.telekom.de",
  "country": "DE",
  "profiles": [
    {
      "id": "default",
      "name": "Public IP Transit Recursor",
      "primaryCategory": "Regional",
      "tags": ["ipv4", "ipv6"],
      "endpoints": {
        "primaryDns": "194.25.0.60",
        "secondaryDns": "194.25.0.68",
        "ipv6Primary": "2003:180:2:1000::53",
        "ipv6Secondary": "2003:180:2:2000::53",
        "dohUrl": null,
        "dotHostname": null
      },
      "notes": "Deutsche Telekom core IP transit recursive resolvers (dns00.t-ipnet.de). Enforces German CUII industry copyright blocking."
    }
  ]
}
