{
  "id": "andrews-and-arnold",
  "name": "Andrews & Arnold (A&A)",
  "website": "https://www.aa.net.uk/dns/",
  "country": "GB",
  "profiles": [
    {
      "id": "default",
      "name": "Privacy Encrypted Recursor",
      "primaryCategory": "General",
      "tags": ["doh", "dot", "ipv4", "ipv6", "no-log"],
      "endpoints": {
        "primaryDns": "217.169.20.20",
        "secondaryDns": "217.169.20.21",
        "ipv6Primary": "2001:8b0::2020",
        "ipv6Secondary": "2001:8b0::2021",
        "dohUrl": "https://dns.aa.net.uk/dns-query",
        "dotHostname": "dns.aa.net.uk"
      },
      "notes": "Privacy-focused UK ISP running open Anycast DoH and DoT frontends across London data centers with strict zero logging."
    }
  ]
}
