{
  "id": "nextdns",
  "name": "NextDNS",
  "website": "https://nextdns.io",
  "country": "GLOBAL",
  "profiles": [
    {
      "id": "default",
      "name": "Unfiltered Anycast",
      "primaryCategory": "General",
      "tags": ["doh", "dot", "ipv4", "ipv6", "no-log"],
      "endpoints": {
        "primaryDns": "45.90.28.0",
        "secondaryDns": "45.90.30.0",
        "ipv6Primary": "2a07:a8c0::",
        "ipv6Secondary": "2a07:a8c1::",
        "dohUrl": "https://dns.nextdns.io",
        "dotHostname": "dns.nextdns.io"
      },
      "notes": "NextDNS raw Anycast public endpoint without custom configuration attached."
    }
  ]
}
