{
  "id": "digitale-gesellschaft",
  "name": "Digitale Gesellschaft",
  "website": "https://www.digitale-gesellschaft.ch/dns/",
  "country": "CH",
  "profiles": [
    {
      "id": "default",
      "name": "Public Encrypted Resolver",
      "primaryCategory": "General",
      "tags": ["doh", "dot", "ipv4", "ipv6", "no-log"],
      "endpoints": {
        "primaryDns": "185.95.218.42",
        "secondaryDns": "185.95.218.43",
        "ipv6Primary": "2a05:fc84::42",
        "ipv6Secondary": "2a05:fc84::43",
        "dohUrl": "https://dns.digitale-gesellschaft.ch/dns-query",
        "dotHostname": "dns.digitale-gesellschaft.ch"
      },
      "notes": "Swiss digital rights organisation. Operates independent, zero-logging recursive resolvers."
    }
  ]
}
