{
  "id": "shecan",
  "name": "Shecan",
  "website": "https://shecan.ir",
  "country": "IR",
  "profiles": [
    {
      "id": "bypass",
      "name": "Sanctions Bypass",
      "primaryCategory": "Regional",
      "tags": ["ipv4", "bypass"],
      "endpoints": {
        "primaryDns": "178.22.122.100",
        "secondaryDns": "185.51.200.2",
        "ipv6Primary": null,
        "ipv6Secondary": null,
        "dohUrl": null,
        "dotHostname": null
      },
      "notes": "Anti-sanction DNS resolving international developer services, cloud providers, and repositories restricted to Iranian IPs."
    }
  ]
}
